[
  {
    "id": "tech.future.primary_flow",
    "schema_version": 1,
    "kind": "technology",
    "era_id": "future",
    "name_key": "tech.future.primary_flow.name",
    "description_key": "tech.future.primary_flow.desc",
    "fields": {
      "effect_kind": "primary_flow",
      "effect_value": 0.1,
      "allowed_predecessor_ids": [
        "tech.modern.primary_flow",
        "tech.modern.processor_cap"
      ],
      "prerequisite_mode": "any_previously_activated",
      "compatibility_scope": "logistics",
      "repeatable": true,
      "max_stacks": 3,
      "pool_weight": 1
    }
  },
  {
    "id": "tech.future.processor_cap",
    "schema_version": 1,
    "kind": "technology",
    "era_id": "future",
    "name_key": "tech.future.processor_cap.name",
    "description_key": "tech.future.processor_cap.desc",
    "fields": {
      "effect_kind": "processor_cap",
      "effect_value": 0.1,
      "allowed_predecessor_ids": [
        "tech.modern.processor_cap",
        "tech.modern.factory_ceiling"
      ],
      "prerequisite_mode": "any_previously_activated",
      "compatibility_scope": "logistics",
      "repeatable": true,
      "max_stacks": 3,
      "pool_weight": 1
    }
  },
  {
    "id": "tech.future.factory_ceiling",
    "schema_version": 1,
    "kind": "technology",
    "era_id": "future",
    "name_key": "tech.future.factory_ceiling.name",
    "description_key": "tech.future.factory_ceiling.desc",
    "fields": {
      "effect_kind": "factory_ceiling",
      "effect_value": 0.1,
      "allowed_predecessor_ids": [
        "tech.modern.factory_ceiling",
        "tech.modern.primary_flow"
      ],
      "prerequisite_mode": "any_previously_activated",
      "compatibility_scope": "logistics",
      "repeatable": true,
      "max_stacks": 3,
      "pool_weight": 1
    }
  },
  {
    "id": "tech.future.cart_capacity",
    "schema_version": 1,
    "kind": "technology",
    "era_id": "future",
    "name_key": "tech.future.cart_capacity.name",
    "description_key": "tech.future.cart_capacity.desc",
    "fields": {
      "effect_kind": "cart_capacity",
      "effect_value": 1.0,
      "allowed_predecessor_ids": [
        "tech.modern.cart_capacity",
        "tech.modern.primary_flow"
      ],
      "prerequisite_mode": "any_previously_activated",
      "compatibility_scope": "logistics",
      "repeatable": true,
      "max_stacks": 3,
      "pool_weight": 1
    }
  },
  {
    "id": "tech.future.unit_health",
    "schema_version": 1,
    "kind": "technology",
    "era_id": "future",
    "name_key": "tech.future.unit_health.name",
    "description_key": "tech.future.unit_health.desc",
    "fields": {
      "effect_kind": "unit_health",
      "effect_value": 0.1,
      "allowed_predecessor_ids": [
        "tech.modern.unit_health",
        "tech.modern.unit_attack"
      ],
      "prerequisite_mode": "any_previously_activated",
      "compatibility_scope": "unit_era",
      "repeatable": true,
      "max_stacks": 3,
      "pool_weight": 1
    }
  },
  {
    "id": "tech.future.unit_attack",
    "schema_version": 1,
    "kind": "technology",
    "era_id": "future",
    "name_key": "tech.future.unit_attack.name",
    "description_key": "tech.future.unit_attack.desc",
    "fields": {
      "effect_kind": "unit_attack",
      "effect_value": 0.1,
      "allowed_predecessor_ids": [
        "tech.modern.unit_attack",
        "tech.modern.unit_health"
      ],
      "prerequisite_mode": "any_previously_activated",
      "compatibility_scope": "unit_era",
      "repeatable": true,
      "max_stacks": 3,
      "pool_weight": 1
    }
  }
]
